full_filename,filename,type,task_1,task_2,task_3,task_4,content
1.docx,1,docx,"client_id INT PRIMARY KEY; - должен быть PK для уникальной идентификации, INT для экономии памяти и производительности. client_name VARCHAR(50) NOT NULL; - ( В России самое длинное имя из 15 букв, поэтому можно ограничиться и 20, например :) ) client_surname VARCHAR(50) NOT NULL; login VARCHAR(30) UNIQUE NOT NULL; - логин должен быть уникальным city_id INT NOT NULL; - для экономии памяти и производительности. Так же ничего не сказано про отдельную таблицу «cities» - она должна быть + добавить внешний ключ: ALTER TABLE clients ADD CONSTRAINT fk_clients_city FOREIGN KEY (city_id) REFERENCES cities(city_id); age - я бы заменил на birth_date DATE NOT NULL, так как возраст ежегодно устаревает, а по дате его можно вычислить. reg_date DEFAULT CURRENT_DATE NOT NULL; - автоматически будет установлена дата регистрации.","item_id INT PRIMARY KEY, item_name VARCHAR(50) NOT NULL, item_cost NUMERIC(7,2) NOT NULL, Самый простой вариант - добавить поле last_cost_change в таблицу items и создать еще одну таблицу, в которой будем хранить историчность изменений цен. ALTER TABLE items ADD COLUMN last_cost_change DATE DEFAULT CURRENT_DATE; CREATE TABLE cost_history ( item_id INT, item_cost NUMERIC(10,2), date_change_cost DATE DEFAULT CURRENT_DATE ); При изменении цены : INSERT INTO cost_history (item_id, price) VALUES (1, 3990.00); Так же можно добавить триггер, чтобы значение в таблице историчности менялось автоматически.","SELECT d.department_id, d.department_name, SUM(e.salary) AS total_salary FROM employees e JOIN departments d ON e.department_id = d.department_id WHERE d.location_id IN ( SELECT location_id FROM locations WHERE city = ‘SEOUL’ ) AND e.manager_id IS NULL GROUP BY d.department_id, d.department_name HAVING SUM(e.salary) > 100000;","Так как перепрыгнуть «через» предполагает, что мы должны находиться в разных плоскостях, а мы находимся в одной.","1. client_id INT PRIMARY KEY; - должен быть PK для уникальной идентификации, INT для экономии памяти и производительности. client_name VARCHAR(50) NOT NULL; - ( В России самое длинное имя из 15 букв, поэтому можно ограничиться и 20, например :) ) client_surname VARCHAR(50) NOT NULL; login VARCHAR(30) UNIQUE NOT NULL; - логин должен быть уникальным city_id INT NOT NULL; - для экономии памяти и производительности. Так же ничего не сказано про отдельную таблицу «cities» - она должна быть + добавить внешний ключ: ALTER TABLE clients ADD CONSTRAINT fk_clients_city FOREIGN KEY (city_id) REFERENCES cities(city_id); age - я бы заменил на birth_date DATE NOT NULL, так как возраст ежегодно устаревает, а по дате его можно вычислить. reg_date DEFAULT CURRENT_DATE NOT NULL; - автоматически будет установлена дата регистрации. 2. item_id INT PRIMARY KEY, item_name VARCHAR(50) NOT NULL, item_cost NUMERIC(7,2) NOT NULL, Самый простой вариант - добавить поле last_cost_change в таблицу items и создать еще одну таблицу, в которой будем хранить историчность изменений цен. ALTER TABLE items ADD COLUMN last_cost_change DATE DEFAULT CURRENT_DATE; CREATE TABLE cost_history ( item_id INT, item_cost NUMERIC(10,2), date_change_cost DATE DEFAULT CURRENT_DATE ); При изменении цены : INSERT INTO cost_history (item_id, price) VALUES (1, 3990.00); Так же можно добавить триггер, чтобы значение в таблице историчности менялось автоматически. 3. SELECT d.department_id, d.department_name, SUM(e.salary) AS total_salary FROM employees e JOIN departments d ON e.department_id = d.department_id WHERE d.location_id IN ( SELECT location_id FROM locations WHERE city = ‘SEOUL’ ) AND e.manager_id IS NULL GROUP BY d.department_id, d.department_name HAVING SUM(e.salary) > 100000; 4. Так как перепрыгнуть «через» предполагает, что мы должны находиться в разных плоскостях, а мы находимся в одной."
